<?xml version="1.0" encoding="UTF-8"?>
<SM2013DynaSpm xsi:schemaLocation="http://nav.no/dokument/ekstern/sykmelding/dynamiskregelsett/SM2013DynaSpm/v1 SM2013DynaSpm.xsd" xmlns="http://nav.no/dokument/ekstern/sykmelding/dynamiskregelsett/SM2013DynaSpm/v1" xmlns:xsi="http://www.w3.org/2001/XMLSchema-instance">
	<RegelSettVersjon>3</RegelSettVersjon>
		<!--  7 uker  -->
		<DynaGruppe>  
		<DynaGruppeId>6.3</DynaGruppeId>
		<DynaGruppeTekst>Opplysninger ved vurdering av aktivitetskravet og NAVs oppfølging</DynaGruppeTekst>
		<Beskrivelse>Utdypende opplysninger ved uke 7 (til NAVs vurdering av aktivitetskravet)</Beskrivelse>
		<DynaRegler>UtdypendeOpplysninger1</DynaRegler>
		<DynaSpm>
			<DynaSpmId>6.3.1</DynaSpmId>
			<DynaSpmTekst>Beskriv kort sykehistorie, symptomer og funn. Hvordan påvirker helsetilstanden funksjonen i arbeid og dagligliv?</DynaSpmTekst>
			<Beskrivelse></Beskrivelse>
			<Restriksjon>A</Restriksjon>
		</DynaSpm>
		<DynaSpm>
			<DynaSpmId>6.3.2</DynaSpmId>
			<DynaSpmTekst>Beskriv pågående og planlagt utredning og/eller behandling. Lar dette seg kombinere med delvis arbeid?</DynaSpmTekst>
			<Beskrivelse></Beskrivelse>
			<Restriksjon>A</Restriksjon>
		</DynaSpm>
	</DynaGruppe>
	<DynaGruppe>  <!-- 17 uker -->
		<DynaGruppeId>6.4</DynaGruppeId>
		<DynaGruppeTekst>Helseopplysninger til NAVs videre vurdering av oppfølging</DynaGruppeTekst>
		<Beskrivelse>Utdypende opplysninger ved uke 17 (til NAVs vurdering av oppfølgingen)</Beskrivelse>
		<DynaRegler>UtdypendeOpplysninger2</DynaRegler>
		<DynaSpm>
			<DynaSpmId>6.4.1</DynaSpmId>
			<DynaSpmTekst>Beskriv kort sykdomsutviklingen, symptomer og funn. Hvordan påvirker helsetilstanden funksjonen i arbeid og dagligliv?</DynaSpmTekst>
			<Beskrivelse></Beskrivelse>
			<Restriksjon>A</Restriksjon>
		</DynaSpm>
		<DynaSpm>
			<DynaSpmId>6.4.2</DynaSpmId>
			<DynaSpmTekst>Beskriv pågående og planlagt utredning og/eller behandling. Lar dette seg kombinere med delvis arbeid?</DynaSpmTekst>
			<Beskrivelse></Beskrivelse>
			<Restriksjon>A</Restriksjon>
		</DynaSpm>
		<DynaSpm>
			<DynaSpmId>6.4.3</DynaSpmId>
			<DynaSpmTekst>Hva mener du skal til for at pasienten kan komme tilbake i eget eller annet arbeid?</DynaSpmTekst>
			<Beskrivelse></Beskrivelse>
			<Restriksjon>A</Restriksjon>
		</DynaSpm>
	</DynaGruppe>
	<DynaGruppe>  <!-- 39 uker -->
		<DynaGruppeId>6.5</DynaGruppeId>
		<DynaGruppeTekst>Helseopplysninger til NAVs videre vurdering av oppfølging</DynaGruppeTekst>
		<Beskrivelse>Utdypende opplysninger ved uke 39 uker (mot slutten av sykepengeperioden)</Beskrivelse>
		<DynaRegler>UtdypendeOpplysninger3</DynaRegler>
		<DynaSpm>
			<DynaSpmId>6.5.1</DynaSpmId>
			<DynaSpmTekst>Beskriv kort sykdomsutviklingen, symptomer og funn. Hvordan påvirker helsetilstanden funksjonen i arbeid og dagligliv?</DynaSpmTekst>
			<Beskrivelse></Beskrivelse>
			<Restriksjon>A</Restriksjon>
		</DynaSpm>
		<DynaSpm>
			<DynaSpmId>6.5.2</DynaSpmId>
			<DynaSpmTekst>Beskriv pågående og planlagt utredning og/eller behandling. Lar dette seg kombinere med delvis arbeid?</DynaSpmTekst>
			<Beskrivelse></Beskrivelse>
			<Restriksjon>A</Restriksjon>
		</DynaSpm>
		<DynaSpm>
			<DynaSpmId>6.5.3</DynaSpmId>
			<DynaSpmTekst>Kan arbeidsevnen bedres gjennom medisinsk behandling og/eller arbeidsrelatert aktivitet? I så fall hvordan? Angi tidsperspektiv</DynaSpmTekst>
			<Beskrivelse></Beskrivelse>
			<Restriksjon>A</Restriksjon>
		</DynaSpm>
	</DynaGruppe>
	<!-- dynagruppe AAP -->
	<DynaGruppe>  
		<DynaGruppeId>6.6</DynaGruppeId>
		<DynaGruppeTekst>Helseopplysninger dersom pasienten søker om AAP</DynaGruppeTekst>
		<Beskrivelse>Husk at pasienten selv må søke om AAP</Beskrivelse>
		<DynaRegler>UtdypendeOpplysninger3</DynaRegler>
		<Obligatorisk>N</Obligatorisk> 
		<DynaSpm>
			<DynaSpmId>6.6.1</DynaSpmId>
			<DynaSpmTekst>Hva antar du at pasienten kan utføre av eget arbeid/arbeidsoppgaver i dag eller i nær framtid?</DynaSpmTekst>
			<Beskrivelse></Beskrivelse>
			<Restriksjon>A</Restriksjon>
			<Obligatorisk>N</Obligatorisk> 
		</DynaSpm>
		<DynaSpm>
			<DynaSpmId>6.6.2</DynaSpmId>
			<DynaSpmTekst>Hvis pasienten ikke kan gå tilbake til eget arbeid, hva antar du at pasienten kan utføre av annet arbeid/arbeidsoppgaver?</DynaSpmTekst>
			<Beskrivelse></Beskrivelse>
			<Restriksjon>A</Restriksjon>
			<Obligatorisk>N</Obligatorisk>
		</DynaSpm>
		<DynaSpm>
			<DynaSpmId>6.6.3</DynaSpmId>
			<DynaSpmTekst>Hvilken betydning har denne sykdommen for den nedsatte arbeidsevnen?</DynaSpmTekst>
			<Beskrivelse></Beskrivelse>
			<Restriksjon>A</Restriksjon>
			<Obligatorisk>N</Obligatorisk> 
		</DynaSpm>
	</DynaGruppe>
</SM2013DynaSpm>
